{"agent_capability":"technical-implementer","cost":{"context":"unknown","tools":"unknown"},"event_id":"canonical-pwd-task-helped","inference_id":"canonical-pwd-consumer-root","inference_revision":1,"outcome":"task-6.5-corrected-interface","reason":"The inference directly guided the corrective implementation.","schema_version":1,"sequence":3,"source":{"analysis_ref":"planos/026-melhoria-plan-execution-workflow/retrospetivas/fase6/retrospectiva-task-6.5-canonical-pwd.md","evidence_refs":["planos/026-melhoria-plan-execution-workflow/task-6.5.md"],"handoff_id":"direct-user-feedback","run_id":"plan-026-task-6.5"},"stage":"task-helped"}
