{"agent_capability":"technical-implementer","cost":{"context":"unknown","tools":"unknown"},"event_id":"canonical-pwd-investigated","inference_id":"canonical-pwd-consumer-root","inference_revision":1,"outcome":"contract-impact-mapped","reason":"The redundant parameter and all affected surfaces were mapped.","schema_version":1,"sequence":1,"source":{"analysis_ref":"planos/026-melhoria-plan-execution-workflow/retrospetivas/fase6/retrospectiva-task-6.5-canonical-pwd.md","evidence_refs":["planos/026-melhoria-plan-execution-workflow/builds/fase6/task-6.5-technical-review.md"],"handoff_id":"direct-user-feedback","run_id":"plan-026-task-6.5"},"stage":"investigated"}
